{
  "weapons": [
    "W01",
    "W02",
    "W03",
    "W04",
    "W05",
    "W06",
    "W07",
    "W08"
  ],
  "current_missile_storage_list": [
    "M01",
    "M02",
    "M03",
    "M04",
    "M05",
    "M06",
    "M07",
    "M08",
    "M09",
    "M10",
    "M11",
    "M12",
    "M13",
    "M14"
  ],
  "missile_distance_to_asset": {
    "M01": 22.3,
    "M02": 26.6,
    "M03": 30.9,
    "M04": 30.8,
    "M05": 35.1,
    "M06": 39.4,
    "M07": 43.7,
    "M08": 43.6,
    "M09": 47.9,
    "M10": 52.2,
    "M11": 56.5,
    "M12": 56.4,
    "M13": 60.7,
    "M14": 65.0
  },
  "missile_damage_intensity": {
    "M01": 55.5,
    "M02": 66.0,
    "M03": 64.5,
    "M04": 75.0,
    "M05": 85.5,
    "M06": 84.0,
    "M07": 94.5,
    "M08": 105.0,
    "M09": 103.5,
    "M10": 114.0,
    "M11": 124.5,
    "M12": 123.0,
    "M13": 133.5,
    "M14": 144.0
  },
  "weapon_missile_destroy_probability": {
    "W01": {
      "M01": 0.485,
      "M02": 0.62,
      "M03": 0.305,
      "M04": 0.44,
      "M05": 0.575,
      "M06": 0.26,
      "M07": 0.395,
      "M08": 0.53,
      "M09": 0.665,
      "M10": 0.35,
      "M11": 0.485,
      "M12": 0.62,
      "M13": 0.305,
      "M14": 0.44
    },
    "W02": {
      "M01": 0.575,
      "M02": 0.26,
      "M03": 0.395,
      "M04": 0.53,
      "M05": 0.665,
      "M06": 0.35,
      "M07": 0.485,
      "M08": 0.62,
      "M09": 0.305,
      "M10": 0.44,
      "M11": 0.575,
      "M12": 0.26,
      "M13": 0.395,
      "M14": 0.53
    },
    "W03": {
      "M01": 0.665,
      "M02": 0.35,
      "M03": 0.485,
      "M04": 0.62,
      "M05": 0.305,
      "M06": 0.44,
      "M07": 0.575,
      "M08": 0.26,
      "M09": 0.395,
      "M10": 0.53,
      "M11": 0.665,
      "M12": 0.35,
      "M13": 0.485,
      "M14": 0.62
    },
    "W04": {
      "M01": 0.305,
      "M02": 0.44,
      "M03": 0.575,
      "M04": 0.26,
      "M05": 0.395,
      "M06": 0.53,
      "M07": 0.665,
      "M08": 0.35,
      "M09": 0.485,
      "M10": 0.62,
      "M11": 0.305,
      "M12": 0.44,
      "M13": 0.575,
      "M14": 0.26
    },
    "W05": {
      "M01": 0.395,
      "M02": 0.53,
      "M03": 0.665,
      "M04": 0.35,
      "M05": 0.485,
      "M06": 0.62,
      "M07": 0.305,
      "M08": 0.44,
      "M09": 0.575,
      "M10": 0.26,
      "M11": 0.395,
      "M12": 0.53,
      "M13": 0.665,
      "M14": 0.35
    },
    "W06": {
      "M01": 0.485,
      "M02": 0.62,
      "M03": 0.305,
      "M04": 0.44,
      "M05": 0.575,
      "M06": 0.26,
      "M07": 0.395,
      "M08": 0.53,
      "M09": 0.665,
      "M10": 0.35,
      "M11": 0.485,
      "M12": 0.62,
      "M13": 0.305,
      "M14": 0.44
    },
    "W07": {
      "M01": 0.575,
      "M02": 0.26,
      "M03": 0.395,
      "M04": 0.53,
      "M05": 0.665,
      "M06": 0.35,
      "M07": 0.485,
      "M08": 0.62,
      "M09": 0.305,
      "M10": 0.44,
      "M11": 0.575,
      "M12": 0.26,
      "M13": 0.395,
      "M14": 0.53
    },
    "W08": {
      "M01": 0.665,
      "M02": 0.35,
      "M03": 0.485,
      "M04": 0.62,
      "M05": 0.305,
      "M06": 0.44,
      "M07": 0.575,
      "M08": 0.26,
      "M09": 0.395,
      "M10": 0.53,
      "M11": 0.665,
      "M12": 0.35,
      "M13": 0.485,
      "M14": 0.62
    }
  },
  "missile_availability_mask": {
    "M01": 1,
    "M02": 1,
    "M03": 1,
    "M04": 1,
    "M05": 1,
    "M06": 1,
    "M07": 1,
    "M08": 1,
    "M09": 1,
    "M10": 1,
    "M11": 1,
    "M12": 1,
    "M13": 1,
    "M14": 1
  },
  "sampling_interval": 5,
  "switching_penalty_if_reward_style_sample": -0.04,
  "previous_weapon_action_if_switching_penalty_active": {
    "W01": 0,
    "W02": 0,
    "W03": 0,
    "W04": 0,
    "W05": 0,
    "W06": 0,
    "W07": 0,
    "W08": 0
  }
}
